{
  "schema_version": "1.0",
  "kind": "mosaic.collection_plan",
  "plan_id": "aero_design_excel_rows_066_136",
  "title": "航发设计论文起步采集清单：Excel 第66–136行",
  "source": {
    "workbook": "航发设计_论文采集中英关键词与检索图谱(2).xlsx",
    "sha256": "6beea3d5a73405a7e1e829bf57d725f2e69a30c0eaa6ceec802133f685f965eb",
    "selection": {
      "sheet": "起步采集清单",
      "start_excel_row": 66,
      "end_excel_row": 136,
      "inclusive": true
    },
    "term_mapping": {
      "sheet": "术语词表",
      "match": "zh_primary + en_primary"
    },
    "search_queries_sheet": "检索任务"
  },
  "summary": {
    "task_count": 71,
    "domains": {
      "风扇与压气机": 21,
      "燃烧室与加力燃烧室": 24,
      "涡轮": 26
    },
    "priorities": {
      "P0": 56,
      "P1": 15
    }
  },
  "defaults": {
    "search": {
      "sources": [
        "openalex",
        "ntrs",
        "crossref",
        "hal",
        "zenodo",
        "arxiv"
      ],
      "query_mode": "source_adapted",
      "max_queries_per_task": 5,
      "max_results_per_source": 10,
      "prefer_focused": true
    },
    "download": {
      "enabled": true,
      "only_legal_open_access": true,
      "backend": "auto",
      "max_pdfs_per_task": 3,
      "max_concurrent": 3,
      "per_host_concurrent": 1,
      "retry_limit": 3
    },
    "storage": {
      "root_dir": "./collected-papers",
      "directory_layout": "domain/topic/task",
      "filename_mode": "original_paper_title",
      "filename_template": "{title}.pdf",
      "collision_policy": "stable_identifier_suffix",
      "dedupe_by_identifier_and_hash": true,
      "one_download_multiple_task_links": true
    }
  },
  "tasks": [
    {
      "task_id": "T045",
      "excel_row": 66,
      "domain": "风扇与压气机",
      "topic": "部件构型",
      "priority": "P0",
      "keywords": {
        "zh": {
          "primary": "轴流压气机",
          "aliases": [
            "轴流式压气机"
          ]
        },
        "en": {
          "primary": "axial compressor",
          "aliases": [
            "axial-flow compressor"
          ],
          "abbreviation": ""
        }
      },
      "related_terms": [
        "预旋导叶",
        "可调静子叶片",
        "离心压气机"
      ],
      "collection_focus": "部件构型\n部件结构、设计方法与工作原理",
      "retrieval_boundary": "与离心压气机分别建类。",
      "search_queries": {
        "en_broad": "(\"axial compressor\" OR \"axial-flow compressor\")",
        "en_focused": "(\"axial compressor\" OR \"axial-flow compressor\") AND (\"compressor\" OR \"fan\" OR \"turbomachinery\")",
        "zh_broad": "(\"轴流压气机\" OR \"轴流式压气机\")",
        "zh_focused": "(\"轴流压气机\" OR \"轴流式压气机\") AND (\"压气机\" OR \"风扇\" OR \"叶轮机械\")",
        "ntrs_focused": "(\"axial compressor\"|\"axial-flow compressor\")+(\"compressor\"|\"fan\"|\"turbomachinery\")"
      },
      "output_subdir": "风扇与压气机/部件构型/T045_轴流压气机"
    },
    {
      "task_id": "T046",
      "excel_row": 67,
      "domain": "风扇与压气机",
      "topic": "部件构型",
      "priority": "P1",
      "keywords": {
        "zh": {
          "primary": "离心压气机",
          "aliases": [
            "离心式压气机"
          ]
        },
        "en": {
          "primary": "centrifugal compressor",
          "aliases": [],
          "abbreviation": ""
        }
      },
      "related_terms": [
        "轴流压气机",
        "跨声速风扇",
        "整体叶盘"
      ],
      "collection_focus": "部件构型\n部件结构、设计方法与工作原理",
      "retrieval_boundary": "工业资料可按物理相关性补充。",
      "search_queries": {
        "en_broad": "(\"centrifugal compressor\")",
        "en_focused": "(\"centrifugal compressor\") AND (\"compressor\" OR \"fan\" OR \"turbomachinery\")",
        "zh_broad": "(\"离心压气机\" OR \"离心式压气机\")",
        "zh_focused": "(\"离心压气机\" OR \"离心式压气机\") AND (\"压气机\" OR \"风扇\" OR \"叶轮机械\")",
        "ntrs_focused": "(\"centrifugal compressor\")+(\"compressor\"|\"fan\"|\"turbomachinery\")"
      },
      "output_subdir": "风扇与压气机/部件构型/T046_离心压气机"
    },
    {
      "task_id": "T047",
      "excel_row": 68,
      "domain": "风扇与压气机",
      "topic": "部件构型",
      "priority": "P0",
      "keywords": {
        "zh": {
          "primary": "跨声速风扇",
          "aliases": []
        },
        "en": {
          "primary": "transonic fan",
          "aliases": [],
          "abbreviation": ""
        }
      },
      "related_terms": [
        "风扇气动设计",
        "轴流压气机",
        "离心压气机"
      ],
      "collection_focus": "部件构型\n部件结构、设计方法与工作原理",
      "retrieval_boundary": "限定推进用风扇。",
      "search_queries": {
        "en_broad": "(\"transonic fan\")",
        "en_focused": "(\"transonic fan\") AND (\"compressor\" OR \"fan\" OR \"turbomachinery\")",
        "zh_broad": "(\"跨声速风扇\")",
        "zh_focused": "(\"跨声速风扇\") AND (\"压气机\" OR \"风扇\" OR \"叶轮机械\")",
        "ntrs_focused": "(\"transonic fan\")+(\"compressor\"|\"fan\"|\"turbomachinery\")"
      },
      "output_subdir": "风扇与压气机/部件构型/T047_跨声速风扇"
    },
    {
      "task_id": "T048",
      "excel_row": 69,
      "domain": "风扇与压气机",
      "topic": "部件构型",
      "priority": "P1",
      "keywords": {
        "zh": {
          "primary": "整体叶盘",
          "aliases": [
            "整体叶轮盘"
          ]
        },
        "en": {
          "primary": "blisk",
          "aliases": [
            "integrally bladed disk",
            "integrally bladed rotor"
          ],
          "abbreviation": ""
        }
      },
      "related_terms": [
        "叶片失谐",
        "轴流压气机",
        "离心压气机"
      ],
      "collection_focus": "部件构型\n部件结构、设计方法与工作原理",
      "retrieval_boundary": "跨压气机、结构、制造三个主题。",
      "search_queries": {
        "en_broad": "(\"blisk\" OR \"integrally bladed disk\" OR \"integrally bladed rotor\")",
        "en_focused": "(\"blisk\" OR \"integrally bladed disk\" OR \"integrally bladed rotor\") AND (\"compressor\" OR \"fan\" OR \"turbomachinery\")",
        "zh_broad": "(\"整体叶盘\" OR \"整体叶轮盘\")",
        "zh_focused": "(\"整体叶盘\" OR \"整体叶轮盘\") AND (\"压气机\" OR \"风扇\" OR \"叶轮机械\")",
        "ntrs_focused": "(\"blisk\"|\"integrally bladed disk\"|\"integrally bladed rotor\")+(\"compressor\"|\"fan\"|\"turbomachinery\")"
      },
      "output_subdir": "风扇与压气机/部件构型/T048_整体叶盘"
    },
    {
      "task_id": "T049",
      "excel_row": 70,
      "domain": "风扇与压气机",
      "topic": "叶栅设计",
      "priority": "P0",
      "keywords": {
        "zh": {
          "primary": "压气机叶栅",
          "aliases": []
        },
        "en": {
          "primary": "compressor cascade",
          "aliases": [],
          "abbreviation": ""
        }
      },
      "related_terms": [
        "压气机平均半径设计",
        "可控扩散叶型",
        "扩散因子"
      ],
      "collection_focus": "叶栅设计\n叶型设计、叶栅性能与试验",
      "retrieval_boundary": "叶栅试验是高价值基础来源。",
      "search_queries": {
        "en_broad": "(\"compressor cascade\")",
        "en_focused": "(\"compressor cascade\") AND (\"compressor\" OR \"fan\" OR \"turbomachinery\")",
        "zh_broad": "(\"压气机叶栅\")",
        "zh_focused": "(\"压气机叶栅\") AND (\"压气机\" OR \"风扇\" OR \"叶轮机械\")",
        "ntrs_focused": "(\"compressor cascade\")+(\"compressor\"|\"fan\"|\"turbomachinery\")"
      },
      "output_subdir": "风扇与压气机/叶栅设计/T049_压气机叶栅"
    },
    {
      "task_id": "T050",
      "excel_row": 71,
      "domain": "风扇与压气机",
      "topic": "叶栅设计",
      "priority": "P0",
      "keywords": {
        "zh": {
          "primary": "可控扩散叶型",
          "aliases": [
            "可控扩散叶片型线"
          ]
        },
        "en": {
          "primary": "controlled diffusion airfoil",
          "aliases": [
            "controlled diffusion aerofoil"
          ],
          "abbreviation": ""
        }
      },
      "related_terms": [
        "压气机叶栅",
        "扩散因子",
        "预旋导叶"
      ],
      "collection_focus": "叶栅设计\n叶型设计、叶栅性能与试验",
      "retrieval_boundary": "保留airfoil/aerofoil拼写。",
      "search_queries": {
        "en_broad": "(\"controlled diffusion airfoil\" OR \"controlled diffusion aerofoil\")",
        "en_focused": "(\"controlled diffusion airfoil\" OR \"controlled diffusion aerofoil\") AND (\"compressor\" OR \"fan\" OR \"turbomachinery\")",
        "zh_broad": "(\"可控扩散叶型\" OR \"可控扩散叶片型线\")",
        "zh_focused": "(\"可控扩散叶型\" OR \"可控扩散叶片型线\") AND (\"压气机\" OR \"风扇\" OR \"叶轮机械\")",
        "ntrs_focused": "(\"controlled diffusion airfoil\"|\"controlled diffusion aerofoil\")+(\"compressor\"|\"fan\"|\"turbomachinery\")"
      },
      "output_subdir": "风扇与压气机/叶栅设计/T050_可控扩散叶型"
    },
    {
      "task_id": "T051",
      "excel_row": 72,
      "domain": "风扇与压气机",
      "topic": "叶栅设计",
      "priority": "P0",
      "keywords": {
        "zh": {
          "primary": "扩散因子",
          "aliases": []
        },
        "en": {
          "primary": "diffusion factor",
          "aliases": [],
          "abbreviation": ""
        }
      },
      "related_terms": [
        "压气机叶栅",
        "可控扩散叶型",
        "预旋导叶"
      ],
      "collection_focus": "叶栅设计\n叶型设计、叶栅性能与试验",
      "retrieval_boundary": "需附压气机语境，避免扩散过程噪声。",
      "search_queries": {
        "en_broad": "(\"diffusion factor\")",
        "en_focused": "(\"diffusion factor\") AND (\"compressor\" OR \"fan\" OR \"turbomachinery\")",
        "zh_broad": "(\"扩散因子\")",
        "zh_focused": "(\"扩散因子\") AND (\"压气机\" OR \"风扇\" OR \"叶轮机械\")",
        "ntrs_focused": "(\"diffusion factor\")+(\"compressor\"|\"fan\"|\"turbomachinery\")"
      },
      "output_subdir": "风扇与压气机/叶栅设计/T051_扩散因子"
    },
    {
      "task_id": "T052",
      "excel_row": 73,
      "domain": "风扇与压气机",
      "topic": "叶栅设计",
      "priority": "P0",
      "keywords": {
        "zh": {
          "primary": "预旋导叶",
          "aliases": [
            "进口导叶"
          ]
        },
        "en": {
          "primary": "inlet guide vane",
          "aliases": [
            "IGV"
          ],
          "abbreviation": "IGV"
        }
      },
      "related_terms": [
        "轴流压气机",
        "压气机叶栅",
        "可控扩散叶型"
      ],
      "collection_focus": "叶栅设计\n叶型设计、叶栅性能与试验",
      "retrieval_boundary": "IGV有歧义，聚焦检索追加压气机。",
      "search_queries": {
        "en_broad": "(\"inlet guide vane\")",